[I 2025-07-03 11:05:39,403] A new study created in memory with name: no-name-e9925ff4-9581-4593-b2c2-ba488710a459
[I 2025-07-03 11:25:40,414] Trial 0 finished with value: 0.6573257586106624 and parameters: {'lr': 0.00023978541055732594, 'hidden': 256, 'drop': 0.1002125193999111, 'layers': 4, 'focal': False, 'lambda': 1.1182074351136688, 'scheduler_type': 'CosineAnnealingLR', 'scheduler_t_max': 55}. Best is trial 0 with value: 0.6573257586106624.
[I 2025-07-03 11:37:57,138] Trial 1 finished with value: 0.648896596007126 and parameters: {'lr': 0.0004663080329550559, 'hidden': 256, 'drop': 0.01941853782536318, 'layers': 2, 'focal': False, 'lambda': 0.809058340291495, 'scheduler_type': 'CosineAnnealingLR', 'scheduler_t_max': 133}. Best is trial 0 with value: 0.6573257586106624.
[I 2025-07-03 12:00:46,131] Trial 2 finished with value: 0.5474223163913612 and parameters: {'lr': 0.0009547396844523391, 'hidden': 64, 'drop': 0.005542098270517659, 'layers': 4, 'focal': True, 'gamma': 2.135997938632904, 'lambda': 0.725896514049539, 'scheduler_type': 'CosineAnnealingLR', 'scheduler_t_max': 103}. Best is trial 0 with value: 0.6573257586106624.
[I 2025-07-03 12:07:36,441] Trial 3 finished with value: 0.5291193963051166 and parameters: {'lr': 0.004651306596582184, 'hidden': 256, 'drop': 0.095705681871114, 'layers': 3, 'focal': False, 'lambda': 1.683856505530514, 'scheduler_type': 'None'}. Best is trial 0 with value: 0.6573257586106624.
[I 2025-07-03 12:38:40,604] Trial 4 finished with value: 0.46854444629449493 and parameters: {'lr': 0.00010915504053374954, 'hidden': 128, 'drop': 0.38207428361705104, 'layers': 4, 'focal': True, 'gamma': 2.1459209509968082, 'lambda': 0.738389599274168, 'scheduler_type': 'None'}. Best is trial 0 with value: 0.6573257586106624.
[I 2025-07-03 12:39:55,582] Trial 5 pruned. 
[I 2025-07-03 12:41:35,256] Trial 6 pruned. 
/home/localadmin/env/lib/python3.12/site-packages/torch/optim/lr_scheduler.py:28: UserWarning: The verbose parameter is deprecated. Please use get_last_lr() to access the learning rate.
  warnings.warn("The verbose parameter is deprecated. Please use get_last_lr() "
[I 2025-07-03 13:03:02,259] Trial 7 finished with value: 0.6862847790765086 and parameters: {'lr': 0.0005491824454587889, 'hidden': 256, 'drop': 0.17088887566049699, 'layers': 3, 'focal': False, 'lambda': 0.5665524341505498, 'scheduler_type': 'ReduceLROnPlateau', 'scheduler_patience': 7, 'scheduler_factor': 0.30152842214786135}. Best is trial 7 with value: 0.6862847790765086.
[I 2025-07-03 13:05:48,558] Trial 8 pruned. 
[I 2025-07-03 13:07:29,041] Trial 9 pruned. 
/home/localadmin/env/lib/python3.12/site-packages/torch/optim/lr_scheduler.py:28: UserWarning: The verbose parameter is deprecated. Please use get_last_lr() to access the learning rate.
  warnings.warn("The verbose parameter is deprecated. Please use get_last_lr() "
[I 2025-07-03 13:08:39,857] Trial 10 pruned. 
/home/localadmin/env/lib/python3.12/site-packages/torch/optim/lr_scheduler.py:28: UserWarning: The verbose parameter is deprecated. Please use get_last_lr() to access the learning rate.
  warnings.warn("The verbose parameter is deprecated. Please use get_last_lr() "
[I 2025-07-03 13:09:56,740] Trial 11 pruned. 
/home/localadmin/env/lib/python3.12/site-packages/torch/optim/lr_scheduler.py:28: UserWarning: The verbose parameter is deprecated. Please use get_last_lr() to access the learning rate.
  warnings.warn("The verbose parameter is deprecated. Please use get_last_lr() "
[I 2025-07-03 13:11:35,145] Trial 12 pruned. 
/home/localadmin/env/lib/python3.12/site-packages/torch/optim/lr_scheduler.py:28: UserWarning: The verbose parameter is deprecated. Please use get_last_lr() to access the learning rate.
  warnings.warn("The verbose parameter is deprecated. Please use get_last_lr() "
[I 2025-07-03 13:12:41,902] Trial 13 pruned. 
[I 2025-07-03 13:20:48,104] Trial 14 pruned. 
/home/localadmin/env/lib/python3.12/site-packages/torch/optim/lr_scheduler.py:28: UserWarning: The verbose parameter is deprecated. Please use get_last_lr() to access the learning rate.
  warnings.warn("The verbose parameter is deprecated. Please use get_last_lr() "
[I 2025-07-03 13:22:11,270] Trial 15 pruned. 
[I 2025-07-03 13:46:40,095] Trial 16 finished with value: 0.655362410242363 and parameters: {'lr': 0.0005454938282686226, 'hidden': 256, 'drop': 0.33171288688365513, 'layers': 4, 'focal': False, 'lambda': 1.4621768183771708, 'scheduler_type': 'CosineAnnealingLR', 'scheduler_t_max': 53}. Best is trial 7 with value: 0.6862847790765086.
[I 2025-07-03 13:47:52,593] Trial 17 pruned. 
/home/localadmin/env/lib/python3.12/site-packages/torch/optim/lr_scheduler.py:28: UserWarning: The verbose parameter is deprecated. Please use get_last_lr() to access the learning rate.
  warnings.warn("The verbose parameter is deprecated. Please use get_last_lr() "
[I 2025-07-03 13:49:15,340] Trial 18 pruned. 
[I 2025-07-03 13:52:51,711] Trial 19 pruned. 
/home/localadmin/env/lib/python3.12/site-packages/torch/optim/lr_scheduler.py:28: UserWarning: The verbose parameter is deprecated. Please use get_last_lr() to access the learning rate.
  warnings.warn("The verbose parameter is deprecated. Please use get_last_lr() "
[I 2025-07-03 13:54:32,389] Trial 20 pruned. 
[I 2025-07-03 13:56:24,505] Trial 21 pruned. 
[I 2025-07-03 13:58:23,463] Trial 22 pruned. 
[I 2025-07-03 14:00:55,327] Trial 23 pruned. 
[I 2025-07-03 14:04:05,360] Trial 24 pruned. 
[I 2025-07-03 14:05:22,997] Trial 25 pruned. 
/home/localadmin/env/lib/python3.12/site-packages/torch/optim/lr_scheduler.py:28: UserWarning: The verbose parameter is deprecated. Please use get_last_lr() to access the learning rate.
  warnings.warn("The verbose parameter is deprecated. Please use get_last_lr() "
[I 2025-07-03 14:06:54,402] Trial 26 pruned. 
[I 2025-07-03 14:26:46,681] Trial 27 finished with value: 0.6602248105657621 and parameters: {'lr': 0.00038918831622695445, 'hidden': 256, 'drop': 0.2334485349671375, 'layers': 3, 'focal': False, 'lambda': 1.0343417383964535, 'scheduler_type': 'CosineAnnealingLR', 'scheduler_t_max': 76}. Best is trial 7 with value: 0.6862847790765086.
[I 2025-07-03 14:28:11,475] Trial 28 pruned. 
/home/localadmin/env/lib/python3.12/site-packages/torch/optim/lr_scheduler.py:28: UserWarning: The verbose parameter is deprecated. Please use get_last_lr() to access the learning rate.
  warnings.warn("The verbose parameter is deprecated. Please use get_last_lr() "
[I 2025-07-03 14:29:28,089] Trial 29 pruned. 
[I 2025-07-03 14:30:46,494] Trial 30 pruned. 
[I 2025-07-03 14:49:11,686] Trial 31 finished with value: 0.6716968038188239 and parameters: {'lr': 0.0005596134155605532, 'hidden': 256, 'drop': 0.06956457459788767, 'layers': 3, 'focal': False, 'lambda': 1.3642108586001729, 'scheduler_type': 'CosineAnnealingLR', 'scheduler_t_max': 68}. Best is trial 7 with value: 0.6862847790765086.
[I 2025-07-03 14:50:53,946] Trial 32 pruned. 
[I 2025-07-03 15:10:56,459] Trial 33 finished with value: 0.6773323942079341 and parameters: {'lr': 0.0008639954400649968, 'hidden': 256, 'drop': 0.07956692218002473, 'layers': 3, 'focal': False, 'lambda': 0.6963372726779846, 'scheduler_type': 'CosineAnnealingLR', 'scheduler_t_max': 69}. Best is trial 7 with value: 0.6862847790765086.
[I 2025-07-03 15:27:09,877] Trial 34 finished with value: 0.6624644462298307 and parameters: {'lr': 0.000854135643922311, 'hidden': 256, 'drop': 0.0019363167704850859, 'layers': 3, 'focal': False, 'lambda': 0.6609781980870797, 'scheduler_type': 'CosineAnnealingLR', 'scheduler_t_max': 95}. Best is trial 7 with value: 0.6862847790765086.
[I 2025-07-03 15:40:33,091] Trial 35 finished with value: 0.6565609942481155 and parameters: {'lr': 0.0011714183979592392, 'hidden': 256, 'drop': 0.004350642516721133, 'layers': 3, 'focal': False, 'lambda': 0.6563399105877037, 'scheduler_type': 'CosineAnnealingLR', 'scheduler_t_max': 116}. Best is trial 7 with value: 0.6862847790765086.
[I 2025-07-03 15:41:56,303] Trial 36 pruned. 
[I 2025-07-03 15:43:18,434] Trial 37 pruned. 
[I 2025-07-03 15:44:37,323] Trial 38 pruned. 
[I 2025-07-03 15:45:55,773] Trial 39 pruned. 
[I 2025-07-03 15:47:24,261] Trial 40 pruned. 
[I 2025-07-03 15:50:25,994] Trial 41 pruned. 
[I 2025-07-03 16:09:08,368] Trial 42 finished with value: 0.6741759623101216 and parameters: {'lr': 0.0004803779417375916, 'hidden': 256, 'drop': 0.04453758416697833, 'layers': 3, 'focal': False, 'lambda': 0.6412590589135294, 'scheduler_type': 'CosineAnnealingLR', 'scheduler_t_max': 65}. Best is trial 7 with value: 0.6862847790765086.
[I 2025-07-03 16:26:43,352] Trial 43 finished with value: 0.6793946036051899 and parameters: {'lr': 0.0005356810318675151, 'hidden': 256, 'drop': 0.043981700529475434, 'layers': 3, 'focal': False, 'lambda': 0.6288493439648294, 'scheduler_type': 'CosineAnnealingLR', 'scheduler_t_max': 64}. Best is trial 7 with value: 0.6862847790765086.
[I 2025-07-03 16:44:29,154] Trial 44 finished with value: 0.6773998815251836 and parameters: {'lr': 0.0005227620430855648, 'hidden': 256, 'drop': 0.05606920637698776, 'layers': 3, 'focal': False, 'lambda': 0.6041455282852625, 'scheduler_type': 'CosineAnnealingLR', 'scheduler_t_max': 66}. Best is trial 7 with value: 0.6862847790765086.
[I 2025-07-03 16:59:30,178] Trial 45 finished with value: 0.6687290687400319 and parameters: {'lr': 0.000606318998998098, 'hidden': 256, 'drop': 0.046085578581308434, 'layers': 3, 'focal': False, 'lambda': 0.5038318512217645, 'scheduler_type': 'None'}. Best is trial 7 with value: 0.6862847790765086.
/home/localadmin/env/lib/python3.12/site-packages/torch/optim/lr_scheduler.py:28: UserWarning: The verbose parameter is deprecated. Please use get_last_lr() to access the learning rate.
  warnings.warn("The verbose parameter is deprecated. Please use get_last_lr() "
[I 2025-07-03 17:01:43,663] Trial 46 pruned. 
[I 2025-07-03 17:03:09,739] Trial 47 pruned. 
/home/localadmin/env/lib/python3.12/site-packages/torch/optim/lr_scheduler.py:28: UserWarning: The verbose parameter is deprecated. Please use get_last_lr() to access the learning rate.
  warnings.warn("The verbose parameter is deprecated. Please use get_last_lr() "
[I 2025-07-03 17:04:23,909] Trial 48 pruned. 
[I 2025-07-03 17:05:41,737] Trial 49 pruned. 
Best: {'lr': 0.0005491824454587889, 'hidden': 256, 'drop': 0.17088887566049699, 'layers': 3, 'focal': False, 'lambda': 0.5665524341505498, 'scheduler_type': 'ReduceLROnPlateau', 'scheduler_patience': 7, 'scheduler_factor': 0.30152842214786135} 0.6862847790765086